{
  "schema_version": "1.0.0",
  "export_id": "44444444-4444-4444-8444-444444444444",
  "profile_id": "fisma_agency_security",
  "system_id": "55555555-5555-4555-8555-555555555555",
  "package_revision_id": "11111111-1111-4111-8111-111111111111",
  "run_id": "33333333-3333-4333-8333-333333333333",
  "review_revision_id": "66666666-6666-4666-8666-666666666666",
  "approval_id": "77777777-7777-4777-8777-777777777777",
  "created_at": "2026-07-10T20:05:00Z",
  "ai_disclosure": "AI Disclosure: This report was produced with machine assistance. All findings,\nsummaries, and status labels are draft inference bound to the evidence provided\nin the package. They do not constitute an official compliance determination,\nrisk acceptance, certification, or authorization decision. A qualified human\nreviewer must review and approve the content before use in an authoritative\ngovernment or customer process.",
  "authority_manifest_id": "authority.v2",
  "files": [
    {
      "path": "machine/assessment-results.json",
      "media_type": "application/json",
      "sha256": "ffffffffffffffffffffffffffffffffffffffffffffffffffffffffffffffff",
      "size_bytes": 8192,
      "official_schema_id": "https://example.gov/schemas/assessment-results-1.0.json"
    }
  ]
}
